MR ID,First Name,Last Name,Group Name,Marketing Manager,Phone,Email,Address,Comments
MR001,John,Doe,North Region,Manager Smith,+919876543210,john.doe@example.com,"123 Main St, Mumbai, Maharashtra",Senior MR with 5 years experience
MR002,Jane,Smith,South Region,Manager Jones,+919876543211,jane.smith@example.com,"456 Oak Ave, Delhi, Delhi",New hire - started this month
MR003,Mike,Johnson,East Region,Manager Brown,+919876543212,mike.j@example.com,"789 Pine Rd, Kolkata, West Bengal",Specialist in cardiology products
MR004,Sarah,Williams,West Region,Manager Davis,+919876543213,sarah.w@example.com,"321 Elm St, Pune, Maharashtra",Top performer last quarter
MR005,David,Brown,Central Region,Manager Wilson,+919876543214,david.b@example.com,"654 Maple Dr, Hyderabad, Telangana",Expert in diabetes care products
